{"schema_version":"kaiba.provisioning.rpi5-signed-release-manifest/v1alpha2","release_id":"release:rpi5:1","device_class":"raspberry-pi-5-model-b-v1alpha1","source_revision":"0123456789abcdef0123456789abcdef01234567","release_intent_digest":"sha256:51efb3631877af7de8a0a6f15b42f12a29f2b3370a2556348941799fada8528c","signing_policy_digest":"sha256:ada21d45b574b96997739d8244a5ec262657e98730a43dd5ddd5f32bcdb2acb6","expected_customer_key_hash":"sha256:46c9b7b6af2bb5f0460924f9866d006721c783084807c4c3a419d1f1b356c700","artifacts":[{"role":"boot_public_key","kind":"regular_file","digest":"sha256:4f38edec6c83aec34f0094835a4258ae5e3007bd6fcf5bdb76ea0d42710447ae","size_bytes":24},{"role":"device_profile","kind":"regular_file","digest":"sha256:d5259149d31e327383ff09a62c62b3645fe196bd5bc68e1a26f1d9decb3228d2","size_bytes":23},{"role":"platform_adapter","kind":"regular_file","digest":"sha256:f1b0d6fb506b4324eeea2b5fe635f41fc54306d39b1c4a2e305e650dc47e5064","size_bytes":25},{"role":"root_integrity","kind":"regular_file","digest":"sha256:af4dc52f897735313166681b13cdcb0e4edb47820b7d4d6abbdf3cbecb2999ae","size_bytes":23},{"role":"rpi5.boot_image","kind":"regular_file","digest":"sha256:4890d0cafa03e9095ef7feee75b05ee64ef1010faa50293756cb72a4acaaf6fb","size_bytes":24},{"role":"rpi5.boot_signature","kind":"regular_file","digest":"sha256:2823df6e9ec0e9d0cdf03796bfadf0699a895ca6e939f4eea32e099fd09b0425","size_bytes":28},{"role":"rpi5.eeprom_bootsys","kind":"regular_file","digest":"sha256:60178af63700711e21e9a23c57c703bc645424fdc7b6779e664000629faf9173","size_bytes":28},{"role":"rpi5.eeprom_config","kind":"regular_file","digest":"sha256:848f352a77846f0e1c5b1a9417c66fdf7d935c0d65eb3ddac7a8aaa670e6afd8","size_bytes":27},{"role":"rpi5.fresh_commit_bundle","kind":"directory_tree","digest":"sha256:f3a6766e3157ee8d025f69ba95ecddd6d09b8fc2357c846fd1ad00f36e926b8f","size_bytes":33,"tree":{"schema_version":"kaiba.provisioning.rpiboot-directory-tree/v1alpha1","root_mode":"0755","entries":[{"path":"bootcode4.bin","type":"regular_file","mode":"0644","size_bytes":33,"digest":"sha256:4d897aadf9f14c7a6e435a34cc0358b67cc09e9de82d80173598d26bc4dd2d3a"}]}},{"role":"rpi5.fresh_readback_bundle","kind":"directory_tree","digest":"sha256:667fadb789dfeac6207504409941d3594a649f1d9491e5f59899c04b5f8ffe57","size_bytes":35,"tree":{"schema_version":"kaiba.provisioning.rpiboot-directory-tree/v1alpha1","root_mode":"0755","entries":[{"path":"bootcode4.bin","type":"regular_file","mode":"0644","size_bytes":35,"digest":"sha256:274487a099fec70ebb8b156d7d142e02c3f188c93f39fbac30031308c99aa1fd"}]}},{"role":"rpi5.negative_boot_bundle","kind":"directory_tree","digest":"sha256:548009b231144064efc078e13f8a2c2768df8a4c08bab91ecf64cc03966b1c1c","size_bytes":34,"tree":{"schema_version":"kaiba.provisioning.rpiboot-directory-tree/v1alpha1","root_mode":"0755","entries":[{"path":"bootcode4.bin","type":"regular_file","mode":"0644","size_bytes":34,"digest":"sha256:0ae86dec8e4e4305139c40d27ffaa12bbaeede390f7e4387d04374024cf4dab3"}]}},{"role":"rpi5.owned_readback_bundle","kind":"directory_tree","digest":"sha256:bf173b96c7c91ef92ae2a82eac417b1f02c1308ddf9903a9c61b8d30d9344da3","size_bytes":35,"tree":{"schema_version":"kaiba.provisioning.rpiboot-directory-tree/v1alpha1","root_mode":"0755","entries":[{"path":"bootcode4.bin","type":"regular_file","mode":"0644","size_bytes":35,"digest":"sha256:da935addb1bc8ee6f8f28df198c9a2a914c70b997345597efae91a513ed8d18f"}]}},{"role":"rpi5.owned_recovery_bootcode","kind":"regular_file","digest":"sha256:83bc2f1de78cce20b77bf69ba8b2ba0824b853f56ef15c13e971a758f805007a","size_bytes":37},{"role":"rpi5.owned_recovery_bundle","kind":"directory_tree","digest":"sha256:793d6e5790720fe5220368900fd58d17b56d0208808cbee07864a3cb4c558f70","size_bytes":35,"tree":{"schema_version":"kaiba.provisioning.rpiboot-directory-tree/v1alpha1","root_mode":"0755","entries":[{"path":"bootcode4.bin","type":"regular_file","mode":"0644","size_bytes":35,"digest":"sha256:b64fe4906faac53a83a87ff507d3e95f9c4b8473a9ae7fddf354e8440683c364"}]}},{"role":"rpi5.root_data_image","kind":"regular_file","digest":"sha256:c39caeb3b068caa225611397930cff941f7f345b9d5ffbb861cb7c4d2f8f01b0","size_bytes":29},{"role":"rpi5.root_hash_tree_image","kind":"regular_file","digest":"sha256:393a562e50c408050bc8fc3f7d16d87acb65f90f306695bf995f04939ca52772","size_bytes":34},{"role":"rpi5.root_integrity_test_bundle","kind":"directory_tree","digest":"sha256:7e2f8272b60cebeaab9af431c354751c652f94e0af7dc467a3b32594b7a50d93","size_bytes":40,"tree":{"schema_version":"kaiba.provisioning.rpiboot-directory-tree/v1alpha1","root_mode":"0755","entries":[{"path":"bootcode4.bin","type":"regular_file","mode":"0644","size_bytes":40,"digest":"sha256:8fd8cf04ae498da447b03f576a8f47c955c09f118ee0516292143d3a738d8f3b"}]}},{"role":"rpi5.signed_eeprom_image","kind":"regular_file","digest":"sha256:a9a5efe38a57e12771448e7898b9b7add6bf49c790d2447ff881fc4a97ab3d6b","size_bytes":33}]}
